{
  "id": "TEST-014",
  "control": "ASC-014",
  "title": "Third-Party Provider Security Review",

  "objective": "Verify vendor assessment process exists",

  "test_steps": [
    "Review vendor documentation",
    "Validate security questionnaire",
    "Verify risk classification"
  ],

  "expected_results": [
    "Assessment completed",
    "Risk documented"
  ],

  "pass_criteria": [
    "Vendor approved or rejected"
  ],

  "severity": "Medium"
}
